{
  "_doc": "Paquete AL (ADR 0059 punto 4): la capa de build del rival ordinario baja de 2/7/9 a 2/1/2 perks por plantilla. Se conserva SIEMPRE el perk letal (RF-012c, ADR 0048) -quitarlo hundia deathsPerRun de 1,44 a 0,55, medido- y una pieza de la linea que da identidad al rival. Los maestros (killing_range, granite_line, blood_tithe) salen: sin su linea detras no cumplen su requiresPerks y no serian legibles. ",
  "id": "act3_dwarf_ironkings",
  "clanId": "bastion",
  "name": {
    "es": "Bastión de Granito",
    "en": "Granite Bastion"
  },
  "description": {
    "es": "Bastión de Granito, coronado: los mismos enanos, tras generaciones sin encajar un gol fácil ni retirar una entrada a tiempo.",
    "en": "Granite Bastion, crowned: the same dwarves, generations on, still never conceding an easy goal or pulling out of a tackle in time."
  },
  "race": "Dwarf",
  "act": 3,
  "difficulty": 5,
  "players": [
    {
      "name": "Borin Yunquefirme",
      "position": "Goalkeeper",
      "rarity": "rare",
      "level": 5,
      "attributes": {
        "strength": 87,
        "speed": 54,
        "technique": 49,
        "stamina": 91,
        "leash": 71
      },
      "styleTag": "Bulwark",
      "traits": [
        "Wall"
      ]
    },
    {
      "name": "Dagnar Escudopétreo",
      "position": "Defender",
      "rarity": "uncommon",
      "level": 5,
      "attributes": {
        "strength": 92,
        "speed": 56,
        "technique": 49,
        "stamina": 94,
        "leash": 71
      },
      "styleTag": "Bulwark",
      "traits": [
        "Resilient"
      ]
    },
    {
      "name": "Eldrin Golpefrío",
      "position": "Defender",
      "rarity": "common",
      "level": 5,
      "attributes": {
        "strength": 92,
        "speed": 56,
        "technique": 49,
        "stamina": 94,
        "leash": 71
      },
      "styleTag": "Bulwark"
    },
    {
      "name": "Fendrel Barbahierro",
      "position": "Midfielder",
      "rarity": "common",
      "level": 5,
      "attributes": {
        "strength": 82,
        "speed": 59,
        "technique": 62,
        "stamina": 96,
        "leash": 71
      }
    },
    {
      "name": "Grimnir Cavaprofundo",
      "position": "Midfielder",
      "rarity": "common",
      "level": 5,
      "attributes": {
        "strength": 82,
        "speed": 59,
        "technique": 62,
        "stamina": 96,
        "leash": 71
      }
    },
    {
      "name": "Hjalmar Vetaoro",
      "position": "Midfielder",
      "rarity": "common",
      "level": 5,
      "attributes": {
        "strength": 82,
        "speed": 59,
        "technique": 62,
        "stamina": 96,
        "leash": 71
      }
    },
    {
      "name": "Ivarr Forjagrís",
      "position": "Forward",
      "rarity": "common",
      "level": 5,
      "attributes": {
        "strength": 84,
        "speed": 64,
        "technique": 59,
        "stamina": 88,
        "leash": 71
      },
      "styleTag": "Brute",
      "traits": [
        "Aggressive"
      ],
      "perks": [
        "iron_studs",
        "marrow_thirst"
      ]
    },
    {
      "name": "Joric Puñoroca",
      "position": "Defender",
      "rarity": "common",
      "level": 5,
      "attributes": {
        "strength": 92,
        "speed": 56,
        "technique": 49,
        "stamina": 94,
        "leash": 71
      },
      "styleTag": "Bulwark"
    },
    {
      "name": "Kordan Martillonegro",
      "position": "Midfielder",
      "rarity": "common",
      "level": 5,
      "attributes": {
        "strength": 82,
        "speed": 59,
        "technique": 62,
        "stamina": 96,
        "leash": 71
      }
    },
    {
      "name": "Loric Tallapiedra",
      "position": "Forward",
      "rarity": "common",
      "level": 5,
      "attributes": {
        "strength": 84,
        "speed": 64,
        "technique": 59,
        "stamina": 88,
        "leash": 71
      }
    }
  ]
}
