{
  "_doc": "Paquete AL (ADR 0059 punto 4): la capa de build del rival ordinario baja de 2/7/9 a 2/1/2 perks por plantilla. Se conserva SIEMPRE el perk letal (RF-012c, ADR 0048) -quitarlo hundia deathsPerRun de 1,44 a 0,55, medido- y una pieza de la linea que da identidad al rival. Los maestros (killing_range, granite_line, blood_tithe) salen: sin su linea detras no cumplen su requiresPerks y no serian legibles. ",
  "id": "act1_orc_ironclad",
  "clanId": "ironclad",
  "name": {
    "es": "Yunque Verde",
    "en": "Green Anvil"
  },
  "description": {
    "es": "Orcos que aguantan el golpe y lo devuelven con intereses: cuanto más les pegas, más aguantan.",
    "en": "Orcs who take the hit and send it back with interest: the harder you hit them, the longer they stand."
  },
  "race": "Orc",
  "act": 1,
  "difficulty": 1,
  "players": [
    {
      "name": "Grok Comecráneos",
      "position": "Goalkeeper",
      "rarity": "common",
      "level": 1,
      "attributes": {
        "strength": 55,
        "speed": 36,
        "technique": 25,
        "stamina": 53,
        "leash": 45
      },
      "traits": [
        "Wall"
      ],
      "perks": [
        "bulwark_stance"
      ]
    },
    {
      "name": "Urzag Tragaclavos",
      "position": "Defender",
      "rarity": "uncommon",
      "level": 1,
      "attributes": {
        "strength": 60,
        "speed": 38,
        "technique": 25,
        "stamina": 56,
        "leash": 45
      },
      "traits": [
        "Aggressive"
      ],
      "perks": [
        "scar_tissue"
      ]
    },
    {
      "name": "Morg Muerdehierro",
      "position": "Defender",
      "rarity": "common",
      "level": 1,
      "attributes": {
        "strength": 60,
        "speed": 38,
        "technique": 25,
        "stamina": 56,
        "leash": 45
      }
    },
    {
      "name": "Thrak Quiebraespinas",
      "position": "Midfielder",
      "rarity": "common",
      "level": 1,
      "attributes": {
        "strength": 50,
        "speed": 41,
        "technique": 38,
        "stamina": 58,
        "leash": 45
      }
    },
    {
      "name": "Bolg Comecráneos",
      "position": "Midfielder",
      "rarity": "common",
      "level": 1,
      "attributes": {
        "strength": 50,
        "speed": 41,
        "technique": 38,
        "stamina": 58,
        "leash": 45
      }
    },
    {
      "name": "Gashk Tragaclavos",
      "position": "Midfielder",
      "rarity": "common",
      "level": 1,
      "attributes": {
        "strength": 50,
        "speed": 41,
        "technique": 38,
        "stamina": 58,
        "leash": 45
      }
    },
    {
      "name": "Ruk Muerdehierro",
      "position": "Forward",
      "rarity": "common",
      "level": 1,
      "attributes": {
        "strength": 52,
        "speed": 46,
        "technique": 35,
        "stamina": 50,
        "leash": 45
      }
    },
    {
      "name": "Zog Quiebraespinas",
      "position": "Defender",
      "rarity": "common",
      "level": 1,
      "attributes": {
        "strength": 60,
        "speed": 38,
        "technique": 25,
        "stamina": 56,
        "leash": 45
      },
      "traits": [
        "Aggressive"
      ]
    },
    {
      "name": "Drog Comecráneos",
      "position": "Midfielder",
      "rarity": "common",
      "level": 1,
      "attributes": {
        "strength": 50,
        "speed": 41,
        "technique": 38,
        "stamina": 58,
        "leash": 45
      }
    },
    {
      "name": "Krum Tragaclavos",
      "position": "Forward",
      "rarity": "common",
      "level": 1,
      "attributes": {
        "strength": 52,
        "speed": 46,
        "technique": 35,
        "stamina": 50,
        "leash": 45
      }
    }
  ]
}
