{
  "_doc": "Paquete AL (ADR 0059 punto 4): la capa de build del rival ordinario baja de 2/7/9 a 2/1/2 perks por plantilla. Se conserva SIEMPRE el perk letal (RF-012c, ADR 0048) -quitarlo hundia deathsPerRun de 1,44 a 0,55, medido- y una pieza de la linea que da identidad al rival. Los maestros (killing_range, granite_line, blood_tithe) salen: sin su linea detras no cumplen su requiresPerks y no serian legibles. ",
  "id": "act3_orc_warlords",
  "clanId": "ironclad",
  "name": {
    "es": "Yunque Verde",
    "en": "Green Anvil"
  },
  "description": {
    "es": "Yunque Verde, señores de la guerra: los mismos orcos que empezaron aguantando golpes y ahora entran a matar hasta en el descuento del descuento.",
    "en": "Green Anvil, warlords now: the same orcs who began by taking hits now go in to kill even in added time of added time."
  },
  "race": "Orc",
  "act": 3,
  "difficulty": 5,
  "players": [
    {
      "name": "Grok Comecráneos",
      "position": "Goalkeeper",
      "rarity": "common",
      "level": 5,
      "attributes": {
        "strength": 93,
        "speed": 68,
        "technique": 51,
        "stamina": 83,
        "leash": 73
      }
    },
    {
      "name": "Urzag Tragaclavos",
      "position": "Defender",
      "rarity": "uncommon",
      "level": 5,
      "attributes": {
        "strength": 98,
        "speed": 70,
        "technique": 51,
        "stamina": 86,
        "leash": 73
      },
      "styleTag": "Brute",
      "traits": [
        "Aggressive",
        "Dirty"
      ],
      "perks": [
        "skullsplitter"
      ]
    },
    {
      "name": "Morg Muerdehierro",
      "position": "Defender",
      "rarity": "common",
      "level": 5,
      "attributes": {
        "strength": 98,
        "speed": 70,
        "technique": 51,
        "stamina": 86,
        "leash": 73
      },
      "styleTag": "Brute"
    },
    {
      "name": "Thrak Quiebraespinas",
      "position": "Midfielder",
      "rarity": "common",
      "level": 5,
      "attributes": {
        "strength": 88,
        "speed": 73,
        "technique": 64,
        "stamina": 88,
        "leash": 73
      },
      "styleTag": "Brute"
    },
    {
      "name": "Bolg Comecráneos",
      "position": "Midfielder",
      "rarity": "common",
      "level": 5,
      "attributes": {
        "strength": 88,
        "speed": 73,
        "technique": 64,
        "stamina": 88,
        "leash": 73
      }
    },
    {
      "name": "Gashk Tragaclavos",
      "position": "Midfielder",
      "rarity": "common",
      "level": 5,
      "attributes": {
        "strength": 88,
        "speed": 73,
        "technique": 64,
        "stamina": 88,
        "leash": 73
      }
    },
    {
      "name": "Ruk Muerdehierro",
      "position": "Forward",
      "rarity": "rare",
      "level": 5,
      "attributes": {
        "strength": 90,
        "speed": 78,
        "technique": 61,
        "stamina": 80,
        "leash": 73
      },
      "styleTag": "Brute",
      "traits": [
        "Aggressive"
      ],
      "perks": [
        "bruised_knuckles"
      ]
    },
    {
      "name": "Zog Quiebraespinas",
      "position": "Defender",
      "rarity": "common",
      "level": 5,
      "attributes": {
        "strength": 98,
        "speed": 70,
        "technique": 51,
        "stamina": 86,
        "leash": 73
      }
    },
    {
      "name": "Drog Comecráneos",
      "position": "Midfielder",
      "rarity": "common",
      "level": 5,
      "attributes": {
        "strength": 88,
        "speed": 73,
        "technique": 64,
        "stamina": 88,
        "leash": 73
      }
    },
    {
      "name": "Krum Tragaclavos",
      "position": "Forward",
      "rarity": "common",
      "level": 5,
      "attributes": {
        "strength": 90,
        "speed": 78,
        "technique": 61,
        "stamina": 80,
        "leash": 73
      }
    }
  ]
}
