{
  "_doc": "Paquete AL (ADR 0059 punto 4): la capa de build del rival ordinario baja de 2/7/9 a 2/1/2 perks por plantilla. Se conserva SIEMPRE el perk letal (RF-012c, ADR 0048) -quitarlo hundia deathsPerRun de 1,44 a 0,55, medido- y una pieza de la linea que da identidad al rival. Los maestros (killing_range, granite_line, blood_tithe) salen: sin su linea detras no cumplen su requiresPerks y no serian legibles. ",
  "id": "act1_elf_swiftwing",
  "clanId": "swiftwing",
  "name": {
    "es": "Ala Veloz",
    "en": "Swiftwing"
  },
  "description": {
    "es": "Bandas rápidas y un cazagoles con hambre: si te ganan la espalda una vez, ya no llegas.",
    "en": "Quick wingers and a hungry poacher up front: get caught square once and you won't catch up."
  },
  "race": "Elf",
  "act": 1,
  "difficulty": 2,
  "players": [
    {
      "name": "Caelum Brisadorada",
      "position": "Goalkeeper",
      "rarity": "common",
      "level": 1,
      "attributes": {
        "strength": 35,
        "speed": 52,
        "technique": 43,
        "stamina": 41,
        "leash": 45
      }
    },
    {
      "name": "Daeris Hojaplata",
      "position": "Defender",
      "rarity": "common",
      "level": 1,
      "attributes": {
        "strength": 40,
        "speed": 54,
        "technique": 43,
        "stamina": 44,
        "leash": 45
      }
    },
    {
      "name": "Elandor Ramaluz",
      "position": "Defender",
      "rarity": "common",
      "level": 1,
      "attributes": {
        "strength": 40,
        "speed": 54,
        "technique": 43,
        "stamina": 44,
        "leash": 45
      }
    },
    {
      "name": "Faelar Espinafina",
      "position": "Midfielder",
      "rarity": "common",
      "level": 1,
      "attributes": {
        "strength": 30,
        "speed": 57,
        "technique": 56,
        "stamina": 46,
        "leash": 45
      },
      "perks": [
        "wing_overlap"
      ]
    },
    {
      "name": "Galion Fuegoquieto",
      "position": "Midfielder",
      "rarity": "common",
      "level": 1,
      "attributes": {
        "strength": 30,
        "speed": 57,
        "technique": 56,
        "stamina": 46,
        "leash": 45
      }
    },
    {
      "name": "Haldir Lunargenta",
      "position": "Midfielder",
      "rarity": "common",
      "level": 1,
      "attributes": {
        "strength": 30,
        "speed": 57,
        "technique": 56,
        "stamina": 46,
        "leash": 45
      }
    },
    {
      "name": "Ithil Cantoalba",
      "position": "Forward",
      "rarity": "uncommon",
      "level": 1,
      "attributes": {
        "strength": 32,
        "speed": 62,
        "technique": 53,
        "stamina": 38,
        "leash": 45
      },
      "traits": [
        "Fast"
      ],
      "perks": [
        "poacher_instinct"
      ]
    },
    {
      "name": "Laeron Rocíogris",
      "position": "Defender",
      "rarity": "common",
      "level": 1,
      "attributes": {
        "strength": 40,
        "speed": 54,
        "technique": 43,
        "stamina": 44,
        "leash": 45
      }
    },
    {
      "name": "Maeron Vientoclaro",
      "position": "Midfielder",
      "rarity": "common",
      "level": 1,
      "attributes": {
        "strength": 30,
        "speed": 57,
        "technique": 56,
        "stamina": 46,
        "leash": 45
      },
      "traits": [
        "Fast"
      ]
    },
    {
      "name": "Naerys Sombraverde",
      "position": "Forward",
      "rarity": "common",
      "level": 1,
      "attributes": {
        "strength": 32,
        "speed": 62,
        "technique": 53,
        "stamina": 38,
        "leash": 45
      }
    }
  ]
}
