{
  "_doc": "Paquete AL (ADR 0059 punto 4): la capa de build del rival ordinario baja de 2/7/9 a 2/1/2 perks por plantilla. Se conserva SIEMPRE el perk letal (RF-012c, ADR 0048) -quitarlo hundia deathsPerRun de 1,44 a 0,55, medido- y una pieza de la linea que da identidad al rival. Los maestros (killing_range, granite_line, blood_tithe) salen: sin su linea detras no cumplen su requiresPerks y no serian legibles. ",
  "id": "act1_dwarf_bastion",
  "clanId": "bastion",
  "name": {
    "es": "Bastión de Granito",
    "en": "Granite Bastion"
  },
  "description": {
    "es": "Un muro de enanos que no se mueve ni con el gol en contra: si se decide algo, se decide en un córner.",
    "en": "A wall of dwarves that won't budge even a goal down: if this match is decided at all, it's on a corner."
  },
  "race": "Dwarf",
  "act": 1,
  "difficulty": 2,
  "players": [
    {
      "name": "Borin Yunquefirme",
      "position": "Goalkeeper",
      "rarity": "uncommon",
      "level": 1,
      "attributes": {
        "strength": 51,
        "speed": 32,
        "technique": 27,
        "stamina": 59,
        "leash": 45
      },
      "traits": [
        "Wall"
      ],
      "perks": [
        "iron_gate"
      ]
    },
    {
      "name": "Dagnar Escudopétreo",
      "position": "Defender",
      "rarity": "common",
      "level": 1,
      "attributes": {
        "strength": 56,
        "speed": 34,
        "technique": 27,
        "stamina": 62,
        "leash": 45
      }
    },
    {
      "name": "Eldrin Golpefrío",
      "position": "Defender",
      "rarity": "common",
      "level": 1,
      "attributes": {
        "strength": 56,
        "speed": 34,
        "technique": 27,
        "stamina": 62,
        "leash": 45
      },
      "traits": [
        "Resilient"
      ],
      "perks": [
        "back_to_back"
      ]
    },
    {
      "name": "Fendrel Barbahierro",
      "position": "Midfielder",
      "rarity": "common",
      "level": 1,
      "attributes": {
        "strength": 46,
        "speed": 37,
        "technique": 40,
        "stamina": 64,
        "leash": 45
      }
    },
    {
      "name": "Grimnir Cavaprofundo",
      "position": "Midfielder",
      "rarity": "common",
      "level": 1,
      "attributes": {
        "strength": 46,
        "speed": 37,
        "technique": 40,
        "stamina": 64,
        "leash": 45
      }
    },
    {
      "name": "Hjalmar Vetaoro",
      "position": "Midfielder",
      "rarity": "common",
      "level": 1,
      "attributes": {
        "strength": 46,
        "speed": 37,
        "technique": 40,
        "stamina": 64,
        "leash": 45
      }
    },
    {
      "name": "Ivarr Forjagrís",
      "position": "Forward",
      "rarity": "common",
      "level": 1,
      "attributes": {
        "strength": 48,
        "speed": 42,
        "technique": 37,
        "stamina": 56,
        "leash": 45
      }
    },
    {
      "name": "Joric Puñoroca",
      "position": "Defender",
      "rarity": "common",
      "level": 1,
      "attributes": {
        "strength": 56,
        "speed": 34,
        "technique": 27,
        "stamina": 62,
        "leash": 45
      }
    },
    {
      "name": "Kordan Martillonegro",
      "position": "Midfielder",
      "rarity": "common",
      "level": 1,
      "attributes": {
        "strength": 46,
        "speed": 37,
        "technique": 40,
        "stamina": 64,
        "leash": 45
      }
    },
    {
      "name": "Loric Tallapiedra",
      "position": "Forward",
      "rarity": "common",
      "level": 1,
      "attributes": {
        "strength": 48,
        "speed": 42,
        "technique": 37,
        "stamina": 56,
        "leash": 45
      }
    }
  ]
}
