{
  "_doc": "Paquete AL (ADR 0059 punto 4): la capa de build del rival ordinario baja de 2/7/9 a 2/1/2 perks por plantilla. Se conserva SIEMPRE el perk letal (RF-012c, ADR 0048) -quitarlo hundia deathsPerRun de 1,44 a 0,55, medido- y una pieza de la linea que da identidad al rival. Los maestros (killing_range, granite_line, blood_tithe) salen: sin su linea detras no cumplen su requiresPerks y no serian legibles. ",
  "id": "act3_elf_stormblades",
  "clanId": "swiftwing",
  "name": {
    "es": "Ala Veloz",
    "en": "Swiftwing"
  },
  "description": {
    "es": "Ala Veloz llegó a la cima: todo el equipo corre para que uno solo remate. Corta esa lanza y se quedan sin plan B.",
    "en": "Swiftwing reached the top: the whole team runs so one man can finish. Cut off that spear and there is no plan B."
  },
  "race": "Elf",
  "act": 3,
  "difficulty": 5,
  "players": [
    {
      "name": "Caelum Brisadorada",
      "position": "Goalkeeper",
      "rarity": "common",
      "level": 5,
      "attributes": {
        "strength": 59,
        "speed": 86,
        "technique": 79,
        "stamina": 73,
        "leash": 73
      },
      "styleTag": "Fine"
    },
    {
      "name": "Daeris Hojaplata",
      "position": "Defender",
      "rarity": "common",
      "level": 5,
      "attributes": {
        "strength": 64,
        "speed": 88,
        "technique": 79,
        "stamina": 76,
        "leash": 73
      },
      "styleTag": "Fine"
    },
    {
      "name": "Elandor Ramaluz",
      "position": "Defender",
      "rarity": "common",
      "level": 5,
      "attributes": {
        "strength": 64,
        "speed": 88,
        "technique": 79,
        "stamina": 76,
        "leash": 73
      },
      "styleTag": "Fine"
    },
    {
      "name": "Faelar Espinafina",
      "position": "Midfielder",
      "rarity": "common",
      "level": 5,
      "attributes": {
        "strength": 54,
        "speed": 91,
        "technique": 92,
        "stamina": 78,
        "leash": 73
      },
      "styleTag": "Fine"
    },
    {
      "name": "Galion Fuegoquieto",
      "position": "Midfielder",
      "rarity": "uncommon",
      "level": 5,
      "attributes": {
        "strength": 54,
        "speed": 91,
        "technique": 92,
        "stamina": 78,
        "leash": 73
      },
      "styleTag": "Fine",
      "perks": [
        "fine_touch",
        "silky_veteran"
      ]
    },
    {
      "name": "Haldir Lunargenta",
      "position": "Midfielder",
      "rarity": "rare",
      "level": 5,
      "attributes": {
        "strength": 54,
        "speed": 91,
        "technique": 92,
        "stamina": 78,
        "leash": 73
      },
      "styleTag": "Fine",
      "traits": [
        "Fast"
      ]
    },
    {
      "name": "Ithil Cantoalba",
      "position": "Forward",
      "rarity": "common",
      "level": 5,
      "attributes": {
        "strength": 56,
        "speed": 96,
        "technique": 89,
        "stamina": 70,
        "leash": 73
      },
      "styleTag": "Fine"
    },
    {
      "name": "Laeron Rocíogris",
      "position": "Defender",
      "rarity": "common",
      "level": 5,
      "attributes": {
        "strength": 64,
        "speed": 88,
        "technique": 79,
        "stamina": 76,
        "leash": 73
      }
    },
    {
      "name": "Maeron Vientoclaro",
      "position": "Midfielder",
      "rarity": "common",
      "level": 5,
      "attributes": {
        "strength": 54,
        "speed": 91,
        "technique": 92,
        "stamina": 78,
        "leash": 73
      },
      "traits": [
        "Fast"
      ]
    },
    {
      "name": "Naerys Sombraverde",
      "position": "Forward",
      "rarity": "common",
      "level": 5,
      "attributes": {
        "strength": 56,
        "speed": 96,
        "technique": 89,
        "stamina": 70,
        "leash": 73
      }
    }
  ]
}
