{
  "_doc": "Paquete AL (ADR 0059 punto 4): la capa de build del rival ordinario baja de 2/7/9 a 2/1/2 perks por plantilla. Se conserva SIEMPRE el perk letal (RF-012c, ADR 0048) -quitarlo hundia deathsPerRun de 1,44 a 0,55, medido- y una pieza de la linea que da identidad al rival. Los maestros (killing_range, granite_line, blood_tithe) salen: sin su linea detras no cumplen su requiresPerks y no serian legibles. ",
  "id": "act3_human_allstars",
  "clanId": "academy",
  "name": {
    "es": "Academia Meridiana",
    "en": "Meridian Academy"
  },
  "description": {
    "es": "La Academia Meridiana, hecha selección: los mismos nombres de aquella aula, ahora en un once sin un solo hueco que explotar.",
    "en": "Meridian Academy, turned national side: the same names from that classroom, now in an XI with no gap to exploit."
  },
  "race": "Human",
  "act": 3,
  "difficulty": 5,
  "players": [
    {
      "name": "Bruno Esteve",
      "position": "Goalkeeper",
      "rarity": "common",
      "level": 5,
      "attributes": {
        "strength": 72,
        "speed": 67,
        "technique": 62,
        "stamina": 72,
        "leash": 72
      }
    },
    {
      "name": "Ciro Haro",
      "position": "Defender",
      "rarity": "common",
      "level": 5,
      "attributes": {
        "strength": 77,
        "speed": 69,
        "technique": 62,
        "stamina": 75,
        "leash": 72
      }
    },
    {
      "name": "Dario Lara",
      "position": "Defender",
      "rarity": "common",
      "level": 5,
      "attributes": {
        "strength": 77,
        "speed": 69,
        "technique": 62,
        "stamina": 75,
        "leash": 72
      }
    },
    {
      "name": "Elio Ortiz",
      "position": "Midfielder",
      "rarity": "rare",
      "level": 5,
      "attributes": {
        "strength": 67,
        "speed": 72,
        "technique": 75,
        "stamina": 77,
        "leash": 72
      },
      "traits": [
        "Leader"
      ],
      "perks": [
        "battle_reader"
      ]
    },
    {
      "name": "Fabio Rubio",
      "position": "Midfielder",
      "rarity": "common",
      "level": 5,
      "attributes": {
        "strength": 67,
        "speed": 72,
        "technique": 75,
        "stamina": 77,
        "leash": 72
      }
    },
    {
      "name": "Gino Ureña",
      "position": "Midfielder",
      "rarity": "common",
      "level": 5,
      "attributes": {
        "strength": 67,
        "speed": 72,
        "technique": 75,
        "stamina": 77,
        "leash": 72
      }
    },
    {
      "name": "Hugo Zamora",
      "position": "Forward",
      "rarity": "uncommon",
      "level": 5,
      "attributes": {
        "strength": 69,
        "speed": 77,
        "technique": 72,
        "stamina": 69,
        "leash": 72
      },
      "traits": [
        "Scorer",
        "Aggressive"
      ],
      "perks": [
        "forward_line"
      ]
    },
    {
      "name": "Ivo Cano",
      "position": "Defender",
      "rarity": "common",
      "level": 5,
      "attributes": {
        "strength": 77,
        "speed": 69,
        "technique": 62,
        "stamina": 75,
        "leash": 72
      }
    },
    {
      "name": "Jano Ferrer",
      "position": "Midfielder",
      "rarity": "common",
      "level": 5,
      "attributes": {
        "strength": 67,
        "speed": 72,
        "technique": 75,
        "stamina": 77,
        "leash": 72
      }
    },
    {
      "name": "Lino Ibarra",
      "position": "Forward",
      "rarity": "common",
      "level": 5,
      "attributes": {
        "strength": 69,
        "speed": 77,
        "technique": 72,
        "stamina": 69,
        "leash": 72
      }
    }
  ]
}
