{
  "_doc": "Paquete AL (ADR 0059 punto 4): la capa de build del rival ordinario baja de 2/7/9 a 2/1/2 perks por plantilla. Se conserva SIEMPRE el perk letal (RF-012c, ADR 0048) -quitarlo hundia deathsPerRun de 1,44 a 0,55, medido- y una pieza de la linea que da identidad al rival. Los maestros (killing_range, granite_line, blood_tithe) salen: sin su linea detras no cumplen su requiresPerks y no serian legibles. ",
  "id": "act2_dwarf_shieldwall",
  "clanId": "bastion",
  "name": {
    "es": "Bastión de Granito",
    "en": "Granite Bastion"
  },
  "description": {
    "es": "Los de Bastión de Granito, ahora con más años y peor carácter: han aprendido que la muralla también puede pegar.",
    "en": "The Granite Bastion lads, older and meaner now: they have learned a wall can hit back too."
  },
  "race": "Dwarf",
  "act": 2,
  "difficulty": 4,
  "players": [
    {
      "name": "Borin Yunquefirme",
      "position": "Goalkeeper",
      "rarity": "common",
      "level": 3,
      "attributes": {
        "strength": 69,
        "speed": 44,
        "technique": 39,
        "stamina": 75,
        "leash": 59
      },
      "styleTag": "Bulwark",
      "traits": [
        "Wall"
      ]
    },
    {
      "name": "Dagnar Escudopétreo",
      "position": "Defender",
      "rarity": "uncommon",
      "level": 3,
      "attributes": {
        "strength": 74,
        "speed": 46,
        "technique": 39,
        "stamina": 78,
        "leash": 59
      },
      "styleTag": "Bulwark",
      "traits": [
        "Resilient"
      ]
    },
    {
      "name": "Eldrin Golpefrío",
      "position": "Defender",
      "rarity": "uncommon",
      "level": 3,
      "attributes": {
        "strength": 74,
        "speed": 46,
        "technique": 39,
        "stamina": 78,
        "leash": 59
      },
      "styleTag": "Bulwark",
      "traits": [
        "Resilient"
      ],
      "perks": [
        "bulwark_stance"
      ]
    },
    {
      "name": "Fendrel Barbahierro",
      "position": "Midfielder",
      "rarity": "common",
      "level": 3,
      "attributes": {
        "strength": 64,
        "speed": 49,
        "technique": 52,
        "stamina": 80,
        "leash": 59
      }
    },
    {
      "name": "Grimnir Cavaprofundo",
      "position": "Midfielder",
      "rarity": "common",
      "level": 3,
      "attributes": {
        "strength": 64,
        "speed": 49,
        "technique": 52,
        "stamina": 80,
        "leash": 59
      }
    },
    {
      "name": "Hjalmar Vetaoro",
      "position": "Midfielder",
      "rarity": "common",
      "level": 3,
      "attributes": {
        "strength": 64,
        "speed": 49,
        "technique": 52,
        "stamina": 80,
        "leash": 59
      }
    },
    {
      "name": "Ivarr Forjagrís",
      "position": "Forward",
      "rarity": "common",
      "level": 3,
      "attributes": {
        "strength": 66,
        "speed": 54,
        "technique": 49,
        "stamina": 72,
        "leash": 59
      },
      "styleTag": "Brute",
      "traits": [
        "Aggressive"
      ]
    },
    {
      "name": "Joric Puñoroca",
      "position": "Defender",
      "rarity": "common",
      "level": 3,
      "attributes": {
        "strength": 74,
        "speed": 46,
        "technique": 39,
        "stamina": 78,
        "leash": 59
      },
      "styleTag": "Bulwark"
    },
    {
      "name": "Kordan Martillonegro",
      "position": "Midfielder",
      "rarity": "common",
      "level": 3,
      "attributes": {
        "strength": 64,
        "speed": 49,
        "technique": 52,
        "stamina": 80,
        "leash": 59
      }
    },
    {
      "name": "Loric Tallapiedra",
      "position": "Forward",
      "rarity": "common",
      "level": 3,
      "attributes": {
        "strength": 66,
        "speed": 54,
        "technique": 49,
        "stamina": 72,
        "leash": 59
      }
    }
  ]
}
