{
  "_doc": "Paquete AL (ADR 0059 punto 4): la capa de build del rival ordinario baja de 2/7/9 a 2/1/2 perks por plantilla. Se conserva SIEMPRE el perk letal (RF-012c, ADR 0048) -quitarlo hundia deathsPerRun de 1,44 a 0,55, medido- y una pieza de la linea que da identidad al rival. Los maestros (killing_range, granite_line, blood_tithe) salen: sin su linea detras no cumplen su requiresPerks y no serian legibles. ",
  "id": "act1_human_academy",
  "clanId": "academy",
  "name": {
    "es": "Academia Meridiana",
    "en": "Meridian Academy"
  },
  "description": {
    "es": "Un equipo de manual: sin estrellas, pero cada uno sabe exactamente dónde tiene que estar.",
    "en": "A textbook side: no stars, but everyone knows exactly where they're supposed to be."
  },
  "race": "Human",
  "act": 1,
  "difficulty": 1,
  "players": [
    {
      "name": "Bruno Esteve",
      "position": "Goalkeeper",
      "rarity": "common",
      "level": 1,
      "attributes": {
        "strength": 47,
        "speed": 42,
        "technique": 37,
        "stamina": 47,
        "leash": 47
      }
    },
    {
      "name": "Ciro Haro",
      "position": "Defender",
      "rarity": "common",
      "level": 1,
      "attributes": {
        "strength": 52,
        "speed": 44,
        "technique": 37,
        "stamina": 50,
        "leash": 47
      }
    },
    {
      "name": "Dario Lara",
      "position": "Defender",
      "rarity": "common",
      "level": 1,
      "attributes": {
        "strength": 52,
        "speed": 44,
        "technique": 37,
        "stamina": 50,
        "leash": 47
      }
    },
    {
      "name": "Elio Ortiz",
      "position": "Midfielder",
      "rarity": "uncommon",
      "level": 1,
      "attributes": {
        "strength": 42,
        "speed": 47,
        "technique": 50,
        "stamina": 52,
        "leash": 47
      },
      "traits": [
        "Leader"
      ],
      "perks": [
        "game_management"
      ]
    },
    {
      "name": "Fabio Rubio",
      "position": "Midfielder",
      "rarity": "common",
      "level": 1,
      "attributes": {
        "strength": 42,
        "speed": 47,
        "technique": 50,
        "stamina": 52,
        "leash": 47
      }
    },
    {
      "name": "Gino Ureña",
      "position": "Midfielder",
      "rarity": "common",
      "level": 1,
      "attributes": {
        "strength": 42,
        "speed": 47,
        "technique": 50,
        "stamina": 52,
        "leash": 47
      }
    },
    {
      "name": "Hugo Zamora",
      "position": "Forward",
      "rarity": "common",
      "level": 1,
      "attributes": {
        "strength": 44,
        "speed": 52,
        "technique": 47,
        "stamina": 44,
        "leash": 47
      },
      "traits": [
        "Cerebral"
      ]
    },
    {
      "name": "Ivo Cano",
      "position": "Defender",
      "rarity": "common",
      "level": 1,
      "attributes": {
        "strength": 52,
        "speed": 44,
        "technique": 37,
        "stamina": 50,
        "leash": 47
      }
    },
    {
      "name": "Jano Ferrer",
      "position": "Midfielder",
      "rarity": "common",
      "level": 1,
      "attributes": {
        "strength": 42,
        "speed": 47,
        "technique": 50,
        "stamina": 52,
        "leash": 47
      }
    },
    {
      "name": "Lino Ibarra",
      "position": "Forward",
      "rarity": "common",
      "level": 1,
      "attributes": {
        "strength": 44,
        "speed": 52,
        "technique": 47,
        "stamina": 44,
        "leash": 47
      }
    }
  ]
}
