{
  "_doc": "Paquete AL (ADR 0059 punto 4): la capa de build del rival ordinario baja de 2/7/9 a 2/1/2 perks por plantilla. Se conserva SIEMPRE el perk letal (RF-012c, ADR 0048) -quitarlo hundia deathsPerRun de 1,44 a 0,55, medido- y una pieza de la linea que da identidad al rival. Los maestros (killing_range, granite_line, blood_tithe) salen: sin su linea detras no cumplen su requiresPerks y no serian legibles. ",
  "id": "act2_undead_deadwalkers",
  "clanId": "graveshift",
  "name": {
    "es": "Turno de Ultratumba",
    "en": "Graveshift"
  },
  "description": {
    "es": "Turno de Ultratumba ya no trabaja de noche: ahora avanza despacio y sin quejarse, y dispara desde donde le pille.",
    "en": "Graveshift no longer works nights only: now it marches on slowly without complaint and shoots from wherever it stands."
  },
  "race": "Undead",
  "act": 2,
  "difficulty": 4,
  "players": [
    {
      "name": "Vex Vozmuerta",
      "position": "Goalkeeper",
      "rarity": "uncommon",
      "level": 4,
      "attributes": {
        "strength": 67,
        "speed": 48,
        "technique": 51,
        "stamina": 73,
        "leash": 61
      },
      "styleTag": "Cold",
      "traits": [
        "Resilient"
      ]
    },
    {
      "name": "Orin Polvorento",
      "position": "Defender",
      "rarity": "common",
      "level": 4,
      "attributes": {
        "strength": 72,
        "speed": 50,
        "technique": 51,
        "stamina": 76,
        "leash": 61
      }
    },
    {
      "name": "Cael Huesoseco",
      "position": "Defender",
      "rarity": "common",
      "level": 4,
      "attributes": {
        "strength": 72,
        "speed": 50,
        "technique": 51,
        "stamina": 76,
        "leash": 61
      }
    },
    {
      "name": "Draven Tumbafría",
      "position": "Midfielder",
      "rarity": "common",
      "level": 4,
      "attributes": {
        "strength": 62,
        "speed": 53,
        "technique": 64,
        "stamina": 78,
        "leash": 61
      },
      "styleTag": "Cold"
    },
    {
      "name": "Malric Nochehueca",
      "position": "Midfielder",
      "rarity": "common",
      "level": 4,
      "attributes": {
        "strength": 62,
        "speed": 53,
        "technique": 64,
        "stamina": 78,
        "leash": 61
      },
      "styleTag": "Cold"
    },
    {
      "name": "Sever Cripta",
      "position": "Midfielder",
      "rarity": "common",
      "level": 4,
      "attributes": {
        "strength": 62,
        "speed": 53,
        "technique": 64,
        "stamina": 78,
        "leash": 61
      },
      "styleTag": "Cold"
    },
    {
      "name": "Thane Cenizagrís",
      "position": "Forward",
      "rarity": "uncommon",
      "level": 4,
      "attributes": {
        "strength": 64,
        "speed": 58,
        "technique": 61,
        "stamina": 70,
        "leash": 61
      },
      "styleTag": "Cold",
      "traits": [
        "Scorer",
        "Aggressive"
      ],
      "perks": [
        "marrow_thirst"
      ]
    },
    {
      "name": "Cyrus Osamenta",
      "position": "Defender",
      "rarity": "common",
      "level": 4,
      "attributes": {
        "strength": 72,
        "speed": 50,
        "technique": 51,
        "stamina": 76,
        "leash": 61
      }
    },
    {
      "name": "Doran Sudariofrío",
      "position": "Midfielder",
      "rarity": "common",
      "level": 4,
      "attributes": {
        "strength": 62,
        "speed": 53,
        "technique": 64,
        "stamina": 78,
        "leash": 61
      }
    },
    {
      "name": "Ezren Sinaliento",
      "position": "Forward",
      "rarity": "common",
      "level": 4,
      "attributes": {
        "strength": 64,
        "speed": 58,
        "technique": 61,
        "stamina": 70,
        "leash": 61
      }
    }
  ]
}
