{
  "_doc": "Paquete AL (ADR 0059 punto 4): la capa de build del rival ordinario baja de 2/7/9 a 2/1/2 perks por plantilla. Se conserva SIEMPRE el perk letal (RF-012c, ADR 0048) -quitarlo hundia deathsPerRun de 1,44 a 0,55, medido- y una pieza de la linea que da identidad al rival. Los maestros (killing_range, granite_line, blood_tithe) salen: sin su linea detras no cumplen su requiresPerks y no serian legibles. ",
  "id": "act1_undead_graveshift",
  "clanId": "graveshift",
  "name": {
    "es": "Turno de Ultratumba",
    "en": "Graveshift"
  },
  "description": {
    "es": "Nunca fallan un partido fuera de casa ni una ocasión clara: el cansancio es cosa de los vivos.",
    "en": "They never miss an away fixture or a clear chance: fatigue is a problem for the living."
  },
  "race": "Undead",
  "act": 1,
  "difficulty": 3,
  "players": [
    {
      "name": "Vex Vozmuerta",
      "position": "Goalkeeper",
      "rarity": "common",
      "level": 2,
      "attributes": {
        "strength": 47,
        "speed": 36,
        "technique": 37,
        "stamina": 57,
        "leash": 47
      }
    },
    {
      "name": "Orin Polvorento",
      "position": "Defender",
      "rarity": "common",
      "level": 2,
      "attributes": {
        "strength": 52,
        "speed": 38,
        "technique": 37,
        "stamina": 60,
        "leash": 47
      }
    },
    {
      "name": "Cael Huesoseco",
      "position": "Defender",
      "rarity": "common",
      "level": 2,
      "attributes": {
        "strength": 52,
        "speed": 38,
        "technique": 37,
        "stamina": 60,
        "leash": 47
      }
    },
    {
      "name": "Draven Tumbafría",
      "position": "Midfielder",
      "rarity": "common",
      "level": 2,
      "attributes": {
        "strength": 42,
        "speed": 41,
        "technique": 50,
        "stamina": 62,
        "leash": 47
      }
    },
    {
      "name": "Malric Nochehueca",
      "position": "Midfielder",
      "rarity": "common",
      "level": 2,
      "attributes": {
        "strength": 42,
        "speed": 41,
        "technique": 50,
        "stamina": 62,
        "leash": 47
      },
      "traits": [
        "Resilient"
      ]
    },
    {
      "name": "Sever Cripta",
      "position": "Midfielder",
      "rarity": "common",
      "level": 2,
      "attributes": {
        "strength": 42,
        "speed": 41,
        "technique": 50,
        "stamina": 62,
        "leash": 47
      }
    },
    {
      "name": "Thane Cenizagrís",
      "position": "Forward",
      "rarity": "common",
      "level": 2,
      "attributes": {
        "strength": 44,
        "speed": 46,
        "technique": 47,
        "stamina": 54,
        "leash": 47
      }
    },
    {
      "name": "Cyrus Osamenta",
      "position": "Defender",
      "rarity": "common",
      "level": 2,
      "attributes": {
        "strength": 52,
        "speed": 38,
        "technique": 37,
        "stamina": 60,
        "leash": 47
      }
    },
    {
      "name": "Doran Sudariofrío",
      "position": "Midfielder",
      "rarity": "common",
      "level": 2,
      "attributes": {
        "strength": 42,
        "speed": 41,
        "technique": 50,
        "stamina": 62,
        "leash": 47
      }
    },
    {
      "name": "Ezren Sinaliento",
      "position": "Forward",
      "rarity": "uncommon",
      "level": 2,
      "attributes": {
        "strength": 44,
        "speed": 46,
        "technique": 47,
        "stamina": 54,
        "leash": 47
      },
      "traits": [
        "Scorer"
      ],
      "perks": [
        "road_warrior"
      ]
    }
  ]
}
